C50.611,Malignant neoplasm of axillary tail of right female breast,Malignant neoplasm,Reportable,Core,,,,
C50.612,Malignant neoplasm of axillary tail of left female breast,Malignant neoplasm,Reportable,Core,,,,
C50.619,Malignant neoplasm of axillary tail of unspecified female breast,Malignant neoplasm,Reportable,Core,,,,
C50.62,"Malignant neoplasm of axillary tail of breast, male",Malignant neoplasm,Subcategory Code,Subcategory Code (Core),,,,
C50.621,Malignant neoplasm of axillary tail of right male breast,Malignant neoplasm,Reportable,Core,,,,
C50.622,Malignant neoplasm of axillary tail of left male breast,Malignant neoplasm,Reportable,Core,,,,
C50.629,Malignant neoplasm of axillary tail of unspecified male breast,Malignant neoplasm,Reportable,Core,,,,
C50.8,Malignant neoplasm of overlapping sites of breast,Malignant neoplasm,Subcategory Code,Subcategory Code (Core),,,,
C50.81,"Malignant neoplasm of overlapping sites of breast, female",Malignant neoplasm,Subcategory Code,Subcategory Code (Core),,,,
C50.811,Malignant neoplasm of overlapping sites of right female breast,Malignant neoplasm,Reportable,Core,,,,
C50.812,Malignant neoplasm of overlapping sites of left female breast,Malignant neoplasm,Reportable,Core,,,,
C50.819,Malignant neoplasm of overlapping sites of unspecified female breast,Malignant neoplasm,Reportable,Core,,,,
C50.82,"Malignant neoplasm of overlapping sites of breast, male",Malignant neoplasm,Subcategory Code,Subcategory Code (Core),,,,
C50.821,Malignant neoplasm of overlapping sites of right male breast,Malignant neoplasm,Reportable,Core,,,,
C50.822,Malignant neoplasm of overlapping sites of left male breast,Malignant neoplasm,Reportable,Core,,,,
C50.829,Malignant neoplasm of overlapping sites of unspecified male breast,Malignant neoplasm,Reportable,Core,,,,
C50.9,Malignant neoplasm of breast of unspecified site,Malignant neoplasm,Subcategory Code,Subcategory Code (Core),,,,
C50.91,"Malignant neoplasm of breast of unspecified site, female",Malignant neoplasm,Subcategory Code,Subcategory Code (Core),,,,
C50.911,Malignant neoplasm of unspecified site of right female breast,Malignant neoplasm,Reportable,Core,,,,
C50.912,Malignant neoplasm of unspecified site of left female breast,Malignant neoplasm,Reportable,Core,,,,
C50.919,Malignant neoplasm of unspecified site of unspecified female breast,Malignant neoplasm,Reportable,Core,,,,
C50.92,"Malignant neoplasm of breast of unspecified site, male",Malignant neoplasm,Subcategory Code,Subcategory Code (Core),,,,
C50.921,Malignant neoplasm of unspecified site of right male breast,Malignant neoplasm,Reportable,Core,,,,
C50.922,Malignant neoplasm of unspecified site of left male breast,Malignant neoplasm,Reportable,Core,,,,
C50.929,Malignant neoplasm of unspecified site of unspecified male breast,Malignant neoplasm,Reportable,Core,,,,
C50.A,Malignant inflammatory neoplasm of breast,Malignant neoplasm,Reportable,Subcategory Code (Core),,,,
C50.A0,Malignant inflammatory neoplasm of unspecified breast,Malignant neoplasm,Reportable,Core,,,,
C50.A1,Malignant inflammatory neoplasm of right breast,Malignant neoplasm,Reportable,Core,,,,
C50.A2,Malignant inflammatory neoplasm of left breast,Malignant neoplasm,Reportable,Core,,,,
C51,Malignant neoplasm of vulva,Malignant neoplasm,Category Code,Subcategory Code (Core),,,,
C51.0,Malignant neoplasm of labium majus,Malignant neoplasm,Reportable,Core,,,,
C51.1,Malignant neoplasm of labium minus,Malignant neoplasm,Reportable,Core,,,,
C51.2,Malignant neoplasm of clitoris,Malignant neoplasm,Reportable,Core,,,,
C51.8,Malignant neoplasm of overlapping sites of vulva,Malignant neoplasm,Reportable,Core,,,,
C51.9,"Malignant neoplasm of vulva, unspecified",Malignant neoplasm,Reportable,Core,,,,
C52,Malignant neoplasm of vagina,Malignant neoplasm,Reportable,Core,,,,
C53,Malignant neoplasm of cervix uteri,Malignant neoplasm,Category Code,Subcategory Code (Core),,,,
C53.0,Malignant neoplasm of endocervix,Malignant neoplasm,Reportable,Core,,,,
C53.1,Malignant neoplasm of exocervix,Malignant neoplasm,Reportable,Core,,,,
C53.8,Malignant neoplasm of overlapping sites of cervix uteri,Malignant neoplasm,Reportable,Core,,,,
C53.9,"Malignant neoplasm of cervix uteri, unspecified",Malignant neoplasm,Reportable,Core,,,,
C54,Malignant neoplasm of corpus uteri,Malignant neoplasm,Category Code,Subcategory Code (Core),,,,
C54.0,Malignant neoplasm of isthmus uteri,Malignant neoplasm,Reportable,Core,,,,
C54.1,Malignant neoplasm of endometrium,Malignant neoplasm,Reportable,Core,,,,
C54.2,Malignant neoplasm of myometrium,Malignant neoplasm,Reportable,Core,,,,
C54.3,Malignant neoplasm of fundus uteri,Malignant neoplasm,Reportable,Core,,,,
C54.8,Malignant neoplasm of overlapping sites of corpus uteri,Malignant neoplasm,Reportable,Core,,,,
C54.9,"Malignant neoplasm of corpus uteri, unspecified",Malignant neoplasm,Reportable,Core,,,,
C55,"Malignant neoplasm of uterus, part unspecified",Malignant neoplasm,Reportable,Core,,,,
C56,Malignant neoplasm of ovary,Malignant neoplasm,Category Code,Subcategory Code (Core),,,,
C56.1,Malignant neoplasm of right ovary,Malignant neoplasm,Reportable,Core,,,,
C56.2,Malignant neoplasm of left ovary,Malignant neoplasm,Reportable,Core,,,,
C56.3,Malignant neoplasm of bilateral ovaries,Malignant neoplasm,Reportable,Core,,,,
C56.9,Malignant neoplasm of unspecified ovary,Malignant neoplasm,Reportable,Core,,,,
C57,Malignant neoplasm of other and unspecified female genital organs,Malignant neoplasm,Category Code,Category Code (Core),,,,
C57.0,Malignant neoplasm of fallopian tube,Malignant neoplasm,Subcategory Code,Subcategory Code (Core),,,,
C57.00,Malignant neoplasm of unspecified fallopian tube,Malignant neoplasm,Reportable,Core,,,,
C57.01,Malignant neoplasm of right fallopian tube,Malignant neoplasm,Reportable,Core,,,,
C57.02,Malignant neoplasm of left fallopian tube,Malignant neoplasm,Reportable,Core,,,,
C57.1,Malignant neoplasm of broad ligament,Malignant neoplasm,Subcategory Code,Subcategory Code (Core),,,,
C57.10,Malignant neoplasm of unspecified broad ligament,Malignant neoplasm,Reportable,Core,,,,
C57.11,Malignant neoplasm of right broad ligament,Malignant neoplasm,Reportable,Core,,,,
C57.12,Malignant neoplasm of left broad ligament,Malignant neoplasm,Reportable,Core,,,,
C57.2,Malignant neoplasm of round ligament,Malignant neoplasm,Subcategory Code,Subcategory Code (Core),,,,
C57.20,Malignant neoplasm of unspecified round ligament,Malignant neoplasm,Reportable,Core,,,,
C57.21,Malignant neoplasm of right round ligament,Malignant neoplasm,Reportable,Core,,,,
C57.22,Malignant neoplasm of left round ligament,Malignant neoplasm,Reportable,Core,,,,
C57.3,Malignant neoplasm of parametrium,Malignant neoplasm,Reportable,Core,,,,
C57.4,"Malignant neoplasm of uterine adnexa, unspecified",Malignant neoplasm,Reportable,Core,,,,
C57.7,Malignant neoplasm of other specified female genital organs,Malignant neoplasm,Reportable,Core,,,,
C57.8,Malignant neoplasm of overlapping sites of female genital organs,Malignant neoplasm,Reportable,Core,,,,
C57.9,"Malignant neoplasm of female genital organ, unspecified",Malignant neoplasm,Reportable,Core,,,,
C58,Malignant neoplasm of placenta,Malignant neoplasm,Reportable,Core,,,,
C60,Malignant neoplasm of penis,Malignant neoplasm,Category Code,Category Code (Core),,,,
C60.0,Malignant neoplasm of prepuce,Malignant neoplasm,Reportable,Core,,,,
C60.1,Malignant neoplasm of glans penis,Malignant neoplasm,Reportable,Core,,,,
C60.2,Malignant neoplasm of body of penis,Malignant neoplasm,Reportable,Core,,,,
C60.8,Malignant neoplasm of overlapping sites of penis,Malignant neoplasm,Reportable,Core,,,,
C60.9,"Malignant neoplasm of penis, unspecified",Malignant neoplasm,Reportable,Core,,,,
C61,Malignant neoplasm of prostate,Malignant neoplasm,Reportable,Core,,,,
C62,Malignant neoplasm of testis,Malignant neoplasm,Category Code,Category Code (Core),,,,
C62.0,Malignant neoplasm of undescended testis,Malignant neoplasm,Subcategory Code,Subcategory Code (Core),,,,
C62.00,Malignant neoplasm of unspecified undescended testis,Malignant neoplasm,Reportable,Core,,,,
C62.01,Malignant neoplasm of undescended right testis,Malignant neoplasm,Reportable,Core,,,,
C62.02,Malignant neoplasm of undescended left testis,Malignant neoplasm,Reportable,Core,,,,
C62.1,Malignant neoplasm of descended testis,Malignant neoplasm,Subcategory Code,Subcategory Code (Core),,,,
C62.10,Malignant neoplasm of unspecified descended testis,Malignant neoplasm,Reportable,Core,,,,
C62.11,Malignant neoplasm of descended right testis,Malignant neoplasm,Reportable,Core,,,,
C62.12,Malignant neoplasm of descended left testis,Malignant neoplasm,Reportable,Core,,,,
C62.9,"Malignant neoplasm of testis, unspecified whether descended or undescended",Malignant neoplasm,Subcategory Code,Subcategory Code (Core),,,,
C62.90,"Malignant neoplasm of unspecified testis, unspecified whether descended or undescended",Malignant neoplasm,Reportable,Core,,,,
C62.91,"Malignant neoplasm of right testis, unspecified whether descended or undescended",Malignant neoplasm,Reportable,Core,,,,
C62.92,"Malignant neoplasm of left testis, unspecified whether descended or undescended",Malignant neoplasm,Reportable,Core,,,,
C63,Malignant neoplasm of other and unspecified male genital organs,Malignant neoplasm,Category Code,Category Code (Core),,,,
C63.0,Malignant neoplasm of epididymis,Malignant neoplasm,Subcategory Code,Subcategory Code (Core),,,,
C63.00,Malignant neoplasm of unspecified epididymis,Malignant neoplasm,Reportable,Core,,,,
C63.01,Malignant neoplasm of right epididymis,Malignant neoplasm,Reportable,Core,,,,
C63.02,Malignant neoplasm of left epididymis,Malignant neoplasm,Reportable,Core,,,,
C63.1,Malignant neoplasm of spermatic cord,Malignant neoplasm,Subcategory Code,Subcategory Code (Core),,,,
C63.10,Malignant neoplasm of unspecified spermatic cord,Malignant neoplasm,Reportable,Core,,,,
C63.11,Malignant neoplasm of right spermatic cord,Malignant neoplasm,Reportable,Core,,,,
C63.12,Malignant neoplasm of left spermatic cord,Malignant neoplasm,Reportable,Core,,,,
C63.2,Malignant neoplasm of scrotum,Malignant neoplasm,Reportable,Core,,,,
C63.7,Malignant neoplasm of other specified male genital organs,Malignant neoplasm,Reportable,Core,,,,
C63.8,Malignant neoplasm of overlapping sites of male genital organs,Malignant neoplasm,Reportable,Core,,,,
C63.9,"Malignant neoplasm of male genital organ, unspecified",Malignant neoplasm,Reportable,Core,,,,
C64,"Malignant neoplasm of kidney, except renal pelvis",Malignant neoplasm,Category Code,Category Code (Core),,,,
C64.1,"Malignant neoplasm of right kidney, except renal pelvis",Malignant neoplasm,Reportable,Core,,,,
C64.2,"Malignant neoplasm of left kidney, except renal pelvis",Malignant neoplasm,Reportable,Core,,,,
C64.9,"Malignant neoplasm of unspecified kidney, except renal pelvis",Malignant neoplasm,Reportable,Core,,,,
C65,Malignant neoplasm of renal pelvis,Malignant neoplasm,Category Code,Category Code (Core),,,,
C65.1,Malignant neoplasm of right renal pelvis,Malignant neoplasm,Reportable,Core,,,,
C65.2,Malignant neoplasm of left renal pelvis,Malignant neoplasm,Reportable,Core,,,,
C65.9,Malignant neoplasm of unspecified renal pelvis,Malignant neoplasm,Reportable,Core,,,,
C66,Malignant neoplasm of ureter,Malignant neoplasm,Category Code,Category Code (Core),,,,
C66.1,Malignant neoplasm of right ureter,Malignant neoplasm,Reportable,Core,,,,
C66.2,Malignant neoplasm of left ureter,Malignant neoplasm,Reportable,Core,,,,
C66.9,Malignant neoplasm of unspecified ureter,Malignant neoplasm,Reportable,Core,,,,
C67,Malignant neoplasm of bladder,Malignant neoplasm,Category Code,Category Code (Core),,,,
C67.0,Malignant neoplasm of trigone of bladder,Malignant neoplasm,Reportable,Core,,,,
C67.1,Malignant neoplasm of dome of bladder,Malignant neoplasm,Reportable,Core,,,,
C67.2,Malignant neoplasm of lateral wall of bladder,Malignant neoplasm,Reportable,Core,,,,
C67.3,Malignant neoplasm of anterior wall of bladder,Malignant neoplasm,Reportable,Core,,,,
C67.4,Malignant neoplasm of posterior wall of bladder,Malignant neoplasm,Reportable,Core,,,,
C67.5,Malignant neoplasm of bladder neck,Malignant neoplasm,Reportable,Core,,,,
C67.6,Malignant neoplasm of ureteric orifice,Malignant neoplasm,Reportable,Core,,,,
C67.7,Malignant neoplasm of urachus,Malignant neoplasm,Reportable,Core,,,,
C67.8,Malignant neoplasm of overlapping sites of bladder,Malignant neoplasm,Reportable,Core,,,,
C67.9,"Malignant neoplasm of bladder, unspecified",Malignant neoplasm,Reportable,Core,,,,
C68,Malignant neoplasm of other and unspecified urinary organs,Malignant neoplasm,Category Code,Category Code (Core),,,,
C68.0,Malignant neoplasm of urethra,Malignant neoplasm,Reportable,Core,,,,
C68.1,Malignant neoplasm of paraurethral glands,Malignant neoplasm,Reportable,Core,,,,
C68.8,Malignant neoplasm of overlapping sites of urinary organs,Malignant neoplasm,Reportable,Core,,,,
C68.9,"Malignant neoplasm of urinary organ, unspecified",Malignant neoplasm,Reportable,Core,,,,
C69,Malignant neoplasm of eye and adnexa,Malignant neoplasm,Category Code,Category Code (Core),,,,
C69.0,Malignant neoplasm of conjunctiva,Malignant neoplasm,Subcategory Code,Subcategory Code (Core),,,,
C69.00,Malignant neoplasm of unspecified conjunctiva,Malignant neoplasm,Reportable,Core,,,,
C69.01,Malignant neoplasm of right conjunctiva,Malignant neoplasm,Reportable,Core,,,,
C69.02,Malignant neoplasm of left conjunctiva,Malignant neoplasm,Reportable,Core,,,,
C69.1,Malignant neoplasm of cornea,Malignant neoplasm,Subcategory Code,Subcategory Code (Core),,,,
C69.10,Malignant neoplasm of unspecified cornea,Malignant neoplasm,Reportable,Core,,,,
C69.11,Malignant neoplasm of right cornea,Malignant neoplasm,Reportable,Core,,,,
C69.12,Malignant neoplasm of left cornea,Malignant neoplasm,Reportable,Core,,,,
C69.2,Malignant neoplasm of retina,Malignant neoplasm,Subcategory Code,Subcategory Code (Core),,,,
C69.20,Malignant neoplasm of unspecified retina,Malignant neoplasm,Reportable,Core,,,,
C69.21,Malignant neoplasm of right retina,Malignant neoplasm,Reportable,Core,,,,
C69.22,Malignant neoplasm of left retina,Malignant neoplasm,Reportable,Core,,,,
C69.3,Malignant neoplasm of choroid,Malignant neoplasm,Subcategory Code,Subcategory Code (Core),,,,
C69.30,Malignant neoplasm of unspecified choroid,Malignant neoplasm,Reportable,Core,,,,
C69.31,Malignant neoplasm of right choroid,Malignant neoplasm,Reportable,Core,,,,
C69.32,Malignant neoplasm of left choroid,Malignant neoplasm,Reportable,Core,,,,
C69.4,Malignant neoplasm of ciliary body,Malignant neoplasm,Subcategory Code,Subcategory Code (Core),,,,
C69.40,Malignant neoplasm of unspecified ciliary body,Malignant neoplasm,Reportable,Core,,,,
C69.41,Malignant neoplasm of right ciliary body,Malignant neoplasm,Reportable,Core,,,,
C69.42,Malignant neoplasm of left ciliary body,Malignant neoplasm,Reportable,Core,,,,
C69.5,Malignant neoplasm of lacrimal gland and duct,Malignant neoplasm,Subcategory Code,Subcategory Code (Core),,,,
C69.50,Malignant neoplasm of unspecified lacrimal gland and duct,Malignant neoplasm,Reportable,Core,,,,
C69.51,Malignant neoplasm of right lacrimal gland and duct,Malignant neoplasm,Reportable,Core,,,,
C69.52,Malignant neoplasm of left lacrimal gland and duct,Malignant neoplasm,Reportable,Core,,,,
C69.6,Malignant neoplasm of orbit,Malignant neoplasm,Subcategory Code,Subcategory Code (Core),,,,
C69.60,Malignant neoplasm of unspecified orbit,Malignant neoplasm,Reportable,Core,,,,
C69.61,Malignant neoplasm of right orbit,Malignant neoplasm,Reportable,Core,,,,
C69.62,Malignant neoplasm of left orbit,Malignant neoplasm,Reportable,Core,,,,
C69.8,Malignant neoplasm of overlapping sites of eye and adnexa,Malignant neoplasm,Subcategory Code,Subcategory Code (Core),,,,
C69.80,Malignant neoplasm of overlapping sites of unspecified eye and adnexa,Malignant neoplasm,Reportable,Core,,,,
C69.81,Malignant neoplasm of overlapping sites of right eye and adnexa,Malignant neoplasm,Reportable,Core,,,,
C69.82,Malignant neoplasm of overlapping sites of left eye and adnexa,Malignant neoplasm,Reportable,Core,,,,
C69.9,Malignant neoplasm of unspecified site of eye,Malignant neoplasm,Subcategory Code,Subcategory Code (Core),,,,
C69.90,Malignant neoplasm of unspecified site of unspecified eye,Malignant neoplasm,Reportable,Core,,,,
C69.91,Malignant neoplasm of unspecified site of right eye,Malignant neoplasm,Reportable,Core,,,,
C69.92,Malignant neoplasm of unspecified site of left eye,Malignant neoplasm,Reportable,Core,,,,
C70,Malignant neoplasm of meninges,Malignant neoplasm,Category Code,Category Code (Core),,,,
C70.0,Malignant neoplasm of cerebral meninges,Malignant neoplasm,Reportable,Core,,,,
C70.1,Malignant neoplasm of spinal meninges,Malignant neoplasm,Reportable,Core,,,,
C70.9,"Malignant neoplasm of meninges, unspecified",Malignant neoplasm,Reportable,Core,,,,
C71,Malignant neoplasm of brain,Malignant neoplasm,Category Code,Category Code (Core),,,,
C71.0,"Malignant neoplasm of cerebrum, except lobes and ventricles",Malignant neoplasm,Reportable,Core,,,,
C71.1,Malignant neoplasm of frontal lobe,Malignant neoplasm,Reportable,Core,,,,
C71.2,Malignant neoplasm of temporal lobe,Malignant neoplasm,Reportable,Core,,,,
C71.3,Malignant neoplasm of parietal lobe,Malignant neoplasm,Reportable,Core,,,,
C71.4,Malignant neoplasm of occipital lobe,Malignant neoplasm,Reportable,Core,,,,
C71.5,Malignant neoplasm of cerebral ventricle,Malignant neoplasm,Reportable,Core,,,,
C71.6,Malignant neoplasm of cerebellum,Malignant neoplasm,Reportable,Core,,,,
C71.7,Malignant neoplasm of brain stem,Malignant neoplasm,Reportable,Core,,,,
C71.8,Malignant neoplasm of overlapping sites of brain,Malignant neoplasm,Reportable,Core,,,,
C71.9,"Malignant neoplasm of brain, unspecified",Malignant neoplasm,Reportable,Core,,,,
C72,"Malignant neoplasm of spinal cord, cranial nerves and other parts of central nervous system",Malignant neoplasm,Category Code,Category Code (Core),,,,
C72.0,Malignant neoplasm of spinal cord,Malignant neoplasm,Reportable,Core,,,,
C72.1,Malignant neoplasm of cauda equina,Malignant neoplasm,Reportable,Core,,,,
C72.2,Malignant neoplasm of olfactory nerve,Malignant neoplasm,Subcategory Code,Subcategory Code (Core),,,,
C72.20,Malignant neoplasm of unspecified olfactory nerve,Malignant neoplasm,Reportable,Core,,,,
C72.21,Malignant neoplasm of right olfactory nerve,Malignant neoplasm,Reportable,Core,,,,
C72.22,Malignant neoplasm of left olfactory nerve,Malignant neoplasm,Reportable,Core,,,,
C72.3,Malignant neoplasm of optic nerve,Malignant neoplasm,Subcategory Code,Subcategory Code (Core),,,,
C72.30,Malignant neoplasm of unspecified optic nerve,Malignant neoplasm,Reportable,Core,,,,
C72.31,Malignant neoplasm of right optic nerve,Malignant neoplasm,Reportable,Core,,,,
C72.32,Malignant neoplasm of left optic nerve,Malignant neoplasm,Reportable,Core,,,,
C72.4,Malignant neoplasm of acoustic nerve,Malignant neoplasm,Subcategory Code,Subcategory Code (Core),,,,
C72.40,Malignant neoplasm of unspecified acoustic nerve,Malignant neoplasm,Reportable,Core,,,,
C72.41,Malignant neoplasm of right acoustic nerve,Malignant neoplasm,Reportable,Core,,,,
C72.42,Malignant neoplasm of left acoustic nerve,Malignant neoplasm,Reportable,Core,,,,
C72.5,Malignant neoplasm of other and unspecified cranial nerves,Malignant neoplasm,Subcategory Code,Subcategory Code (Core),,,,
C72.50,Malignant neoplasm of unspecified cranial nerve,Malignant neoplasm,Reportable,Core,,,,
C72.59,Malignant neoplasm of other cranial nerves,Malignant neoplasm,Reportable,Core,,,,
C72.9,"Malignant neoplasm of central nervous system, unspecified",Malignant neoplasm,Reportable,Core,,,,
C73,Malignant neoplasm of thyroid gland,Malignant neoplasm,Reportable,Core,,,,
C74,Malignant neoplasm of adrenal gland,Malignant neoplasm,Category Code,Category Code (Core),,,,
C74.0,Malignant neoplasm of cortex of adrenal gland,Malignant neoplasm,Subcategory Code,Subcategory Code (Core),,,,
C74.00,Malignant neoplasm of cortex of unspecified adrenal gland,Malignant neoplasm,Reportable,Core,,,,
C74.01,Malignant neoplasm of cortex of right adrenal gland,Malignant neoplasm,Reportable,Core,,,,
C74.02,Malignant neoplasm of cortex of left adrenal gland,Malignant neoplasm,Reportable,Core,,,,
C74.1,Malignant neoplasm of medulla of adrenal gland,Malignant neoplasm,Subcategory Code,Subcategory Code (Core),,,,
C74.10,Malignant neoplasm of medulla of unspecified adrenal gland,Malignant neoplasm,Reportable,Core,,,,
C74.11,Malignant neoplasm of medulla of right adrenal gland,Malignant neoplasm,Reportable,Core,,,,
C74.12,Malignant neoplasm of medulla of left adrenal gland,Malignant neoplasm,Reportable,Core,,,,
C74.9,Malignant neoplasm of unspecified part of adrenal gland,Malignant neoplasm,Subcategory Code,Subcategory Code (Core),,,,
C74.90,Malignant neoplasm of unspecified part of unspecified adrenal gland,Malignant neoplasm,Reportable,Core,,,,
C74.91,Malignant neoplasm of unspecified part of right adrenal gland,Malignant neoplasm,Reportable,Core,,,,
C74.92,Malignant neoplasm of unspecified part of left adrenal gland,Malignant neoplasm,Reportable,Core,,,,
C75,Malignant neoplasm of other endocrine glands and related structures,Malignant neoplasm,Category Code,Subcategory Code (Core),,,,
C75.0,Malignant neoplasm of parathyroid gland,Malignant neoplasm,Reportable,Core,,,,
C75.1,Malignant neoplasm of pituitary gland,Malignant neoplasm,Reportable,Core,,,,
C75.2,Malignant neoplasm of craniopharyngeal duct,Malignant neoplasm,Reportable,Core,,,,
C75.3,Malignant neoplasm of pineal gland,Malignant neoplasm,Reportable,Core,,,,
C75.4,Malignant neoplasm of carotid body,Malignant neoplasm,Reportable,Core,,,,
C75.5,Malignant neoplasm of aortic body and other paraganglia,Malignant neoplasm,Reportable,Core,,,,
C75.8,"Malignant neoplasm with pluriglandular involvement, unspecified",Malignant neoplasm,Reportable,Core,,,,
C75.9,"Malignant neoplasm of endocrine gland, unspecified",Malignant neoplasm,Reportable,Core,,,,
C76,Malignant neoplasm of other and ill-defined sites,Malignant neoplasm,Category Code,Subcategory Code (Core),,,,
C76.0,"Malignant neoplasm of head, face and neck",Malignant neoplasm,Reportable,Core,,,,
C76.1,Malignant neoplasm of thorax,Malignant neoplasm,Reportable,Core,,,,
C76.2,Malignant neoplasm of abdomen,Malignant neoplasm,Reportable,Core,,,,
C76.3,Malignant neoplasm of pelvis,Malignant neoplasm,Reportable,Core,,,,
C76.4,Malignant neoplasm of upper limb,Malignant neoplasm,Subcategory Code,Subcategory Code,,,,
C76.40,Malignant neoplasm of unspecified upper limb,Malignant neoplasm,Reportable,Core,,,,
C76.41,Malignant neoplasm of right upper limb,Malignant neoplasm,Reportable,Core,,,,
C76.42,Malignant neoplasm of left upper limb,Malignant neoplasm,Reportable,Core,,,,
C76.5,Malignant neoplasm of lower limb,Malignant neoplasm,Subcategory Code,Subcategory Code (Core),,,,
C76.50,Malignant neoplasm of unspecified lower limb,Malignant neoplasm,Reportable,Core,,,,
C76.51,Malignant neoplasm of right lower limb,Malignant neoplasm,Reportable,Core,,,,
C76.52,Malignant neoplasm of left lower limb,Malignant neoplasm,Reportable,Core,,,,
C76.8,Malignant neoplasm of other specified ill-defined sites,Malignant neoplasm,Reportable,Core,,,,
C77,Secondary and unspecified malignant neoplasm of lymph nodes,Malignant neoplasm,Category Code,Subcategory Code (Core),,,,
C77.0,"Secondary and unspecified malignant neoplasm of lymph nodes of head, face and neck",Malignant neoplasm,Reportable,Core,,,,
C77.1,Secondary and unspecified malignant neoplasm of intrathoracic lymph nodes,Malignant neoplasm,Reportable,Core,,,,
C77.2,Secondary and unspecified malignant neoplasm of intra-abdominal lymph nodes,Malignant neoplasm,Reportable,Core,,,,
C77.3,Secondary and unspecified malignant neoplasm of axilla and upper limb lymph nodes,Malignant neoplasm,Reportable,Core,,,,
C77.4,Secondary and unspecified malignant neoplasm of inguinal and lower limb lymph nodes,Malignant neoplasm,Reportable,Core,,,,
C77.5,Secondary and unspecified malignant neoplasm of intrapelvic lymph nodes,Malignant neoplasm,Reportable,Core,,,,
C77.8,Secondary and unspecified malignant neoplasm of lymph nodes of multiple regions,Malignant neoplasm,Reportable,Core,,,,
C77.9,"Secondary and unspecified malignant neoplasm of lymph node, unspecified",Malignant neoplasm,Reportable,Core,,,,
C78,Secondary malignant neoplasm of respiratory and digestive organs,Malignant neoplasm,Category Code,Category Code (Core),,,,
C78.0,Secondary malignant neoplasm of lung,Malignant neoplasm,Subcategory Code,Subcategory Code (Core),,,,
C78.00,Secondary malignant neoplasm of unspecified lung,Malignant neoplasm,Reportable,Core,,,,
C78.01,Secondary malignant neoplasm of right lung,Malignant neoplasm,Reportable,Core,,,,
C78.02,Secondary malignant neoplasm of left lung,Malignant neoplasm,Reportable,Core,,,,
C78.1,Secondary malignant neoplasm of mediastinum,Malignant neoplasm,Reportable,Core,,,,
C78.2,Secondary malignant neoplasm of pleura,Malignant neoplasm,Reportable,Core,,,,
C78.3,Secondary malignant neoplasm of other and unspecified respiratory organs,Malignant neoplasm,Subcategory Code,Subcategory Code (Core),,,,
C78.30,Secondary malignant neoplasm of unspecified respiratory organ,Malignant neoplasm,Reportable,Core,,,,
C78.39,Secondary malignant neoplasm of other respiratory organs,Malignant neoplasm,Reportable,Core,,,,
C78.4,Secondary malignant neoplasm of small intestine,Malignant neoplasm,Reportable,Core,,,,
C78.5,Secondary malignant neoplasm of large intestine and rectum,Malignant neoplasm,Reportable,Core,,,,
C78.6,Secondary malignant neoplasm of retroperitoneum and peritoneum,Malignant neoplasm,Reportable,Core,,,,
C78.7,Secondary malignant neoplasm of liver and intrahepatic bile duct,Malignant neoplasm,Reportable,Core,,,,
C78.8,Secondary malignant neoplasm of other and unspecified digestive organs,Malignant neoplasm,Subcategory Code,Subcategory Code (Core),,,,
