C82.66,Cutaneous follicle center lymphoma intrapelvic lymph nodes,Hematopoietic neoplasm,Reportable,Core,,,,
C82.67,Cutaneous follicle center lymphoma spleen,Hematopoietic neoplasm,Reportable,Core,,,,
C82.68,Cutaneous follicle center lymphoma lymph nodes of multiple sites,Hematopoietic neoplasm,Reportable,Core,,,,
C82.69,Cutaneous follicle center lymphoma extranodal and solid organ sites,Hematopoietic neoplasm,Reportable,Core,,,,
C82.6A,Cutaneous follicle center lymphoma in remission,Hematopoietic neoplasm,Reportable,Core,,,,
C82.8,Other types of follicular lymphoma,Hematopoietic neoplasm,Subcategory Code,Subcategory Code (Core),,,,
C82.80,Other types of follicular lymphoma unspecified site,Hematopoietic neoplasm,Reportable,Core,,,,
C82.81,"Other types of follicular lymphoma lymph nodes of head, face, and neck",Hematopoietic neoplasm,Reportable,Core,,,,
C82.82,Other types of follicular lymphoma intrathoracic lymph nodes,Hematopoietic neoplasm,Reportable,Core,,,,
C82.83,Other types of follicular lymphoma intra-abdominal lymph nodes,Hematopoietic neoplasm,Reportable,Core,,,,
C82.84,Other types of follicular lymphoma lymph nodes of axilla and upper limb,Hematopoietic neoplasm,Reportable,Core,,,,
C82.85,Other types of follicular lymphoma lymph nodes of inguinal region and lower limb,Hematopoietic neoplasm,Reportable,Core,,,,
C82.86,Other types of follicular lymphoma intrapelvic lymph nodes,Hematopoietic neoplasm,Reportable,Core,,,,
C82.87,Other types of follicular lymphoma spleen,Hematopoietic neoplasm,Reportable,Core,,,,
C82.88,Other types of follicular lymphoma lymph nodes of multiple sites,Hematopoietic neoplasm,Reportable,Core,,,,
C82.89,Other types of follicular lymphoma extranodal and solid organ sites,Hematopoietic neoplasm,Reportable,Core,,,,
C82.8A,Other types of follicular lymphoma in remission,Hematopoietic neoplasm,Reportable,Core,,,,
C82.9,"Follicular lymphoma, unspecified",Hematopoietic neoplasm,Subcategory Code,Subcategory Code (Core),,,,
C82.90,"Follicular lymphoma, unspecified site",Hematopoietic neoplasm,Reportable,Core,,,,
C82.91,"Follicular lymphoma, unspecified lymph nodes of head, face, and neck",Hematopoietic neoplasm,Reportable,Core,,,,
C82.92,"Follicular lymphoma, unspecified intrathoracic lymph nodes",Hematopoietic neoplasm,Reportable,Core,,,,
C82.93,"Follicular lymphoma, unspecified intra-abdominal lymph nodes",Hematopoietic neoplasm,Reportable,Core,,,,
C82.94,"Follicular lymphoma, unspecified lymph nodes of axilla and upper limb",Hematopoietic neoplasm,Reportable,Core,,,,
C82.95,"Follicular lymphoma, unspecified lymph nodes of inguinal region and lower limb",Hematopoietic neoplasm,Reportable,Core,,,,
C82.96,"Follicular lymphoma, unspecified intrapelvic lymph nodes",Hematopoietic neoplasm,Reportable,Core,,,,
C82.97,"Follicular lymphoma, unspecified spleen",Hematopoietic neoplasm,Reportable,Core,,,,
C82.98,"Follicular lymphoma, unspecified lymph nodes of multiple sites",Hematopoietic neoplasm,Reportable,Core,,,,
C82.99,"Follicular lymphoma, unspecified extranodal and solid organ sites",Hematopoietic neoplasm,Reportable,Core,,,,
C82.9A,"Follicular lymphoma, unspecified in remission",Hematopoietic neoplasm,Reportable,Core,,,,
C83,Non-follicular lymphoma,Hematopoietic neoplasm ,Category Code,Category Code (Core),,,,
C83.0,Small cell B-cell lymphoma,Hematopoietic neoplasm,Subcategory Code,Subcategory Code (Core),,,,
C83.00,Small cell B-cell lymphoma unspecified site,Hematopoietic neoplasm,Reportable,Core,,,,
C83.01,"Small cell B-cell lymphoma lymph nodes of head, face, and neck",Hematopoietic neoplasm,Reportable,Core,,,,
C83.02,Small cell B-cell lymphoma intrathoracic lymph nodes,Hematopoietic neoplasm,Reportable,Core,,,,
C83.03,Small cell B-cell lymphoma intra-abdominal lymph nodes,Hematopoietic neoplasm,Reportable,Core,,,,
C83.04,Small cell B-cell lymphoma lymph nodes of axilla and upper limb,Hematopoietic neoplasm,Reportable,Core,,,,
C83.05,Small cell B-cell lymphoma lymph nodes of inguinal region and lower limb,Hematopoietic neoplasm,Reportable,Core,,,,
C83.06,Small cell B-cell lymphoma intrapelvic lymph nodes,Hematopoietic neoplasm,Reportable,Core,,,,
C83.07,Small cell B-cell lymphoma spleen,Hematopoietic neoplasm,Reportable,Core,,,,
C83.08,Small cell B-cell lymphoma lymph nodes of multiple sites,Hematopoietic neoplasm,Reportable,Core,,,,
C83.09,Small cell B-cell lymphoma extranodal and solid organ sites,Hematopoietic neoplasm,Reportable,Core,,,,
C83.0A,Small cell B-cell lymphoma in remission,Hematopoietic neoplasm,Reportable,Core,,,,
C83.1,Mantle cell lymphoma,Hematopoietic neoplasm,Subcategory Code,Subcategory Code (Core),,,,
C83.10,Mantle cell lymphoma unspecified site,Hematopoietic neoplasm,Reportable,Core,,,,
C83.11,"Mantle cell lymphoma lymph nodes of head, face, and neck",Hematopoietic neoplasm,Reportable,Core,,,,
C83.12,Mantle cell lymphoma intrathoracic lymph nodes,Hematopoietic neoplasm,Reportable,Core,,,,
C83.13,Mantle cell lymphoma intra-abdominal lymph nodes,Hematopoietic neoplasm,Reportable,Core,,,,
C83.14,Mantle cell lymphoma lymph nodes of axilla and upper limb,Hematopoietic neoplasm,Reportable,Core,,,,
C83.15,Mantle cell lymphoma lymph nodes of inguinal region and lower limb,Hematopoietic neoplasm,Reportable,Core,,,,
C83.16,Mantle cell lymphoma intrapelvic lymph nodes,Hematopoietic neoplasm,Reportable,Core,,,,
C83.17,Mantle cell lymphoma spleen,Hematopoietic neoplasm,Reportable,Core,,,,
C83.18,Mantle cell lymphoma lymph nodes of multiple sites,Hematopoietic neoplasm,Reportable,Core,,,,
C83.19,Mantle cell lymphoma extranodal and solid organ sites,Hematopoietic neoplasm,Reportable,Core,,,,
C83.1A,Mantle cell lymphoma in remission,Hematopoietic neoplasm,Reportable,Core,,,,
C83.3,Diffuse large B-cell lymphoma,Hematopoietic neoplasm,Subcategory Code,Subcategory Code (Core),,,,
C83.30,Diffuse large B-cell lymphoma unspecified site,Hematopoietic neoplasm,Reportable,Core,,,,
C83.31,"Diffuse large B-cell lymphoma lymph nodes of head, face, and neck",Hematopoietic neoplasm,Reportable,Core,,,,
C83.32,Diffuse large B-cell lymphoma intrathoracic lymph nodes,Hematopoietic neoplasm,Reportable,Core,,,,
C83.33,Diffuse large B-cell lymphoma intra-abdominal lymph nodes,Hematopoietic neoplasm,Reportable,Core,,,,
C83.34,Diffuse large B-cell lymphoma lymph nodes of axilla and upper limb,Hematopoietic neoplasm,Reportable,Core,,,,
C83.35,Diffuse large B-cell lymphoma lymph nodes of inguinal region and lower limb,Hematopoietic neoplasm,Reportable,Core,,,,
C83.36,Diffuse large B-cell lymphoma intrapelvic lymph nodes,Hematopoietic neoplasm,Reportable,Core,,,,
C83.37,Diffuse large B-cell lymphoma spleen,Hematopoietic neoplasm,Reportable,Core,,,,
C83.38,Diffuse large B-cell lymphoma lymph nodes of multiple sites,Hematopoietic neoplasm,Reportable,Core,,,,
C83.39,Diffuse large B-cell lymphoma extranodal and solid organ sites,Hematopoietic neoplasm,Subcategory Code,Subcategory Code (Core),,,,
C83.390,Primary central nervous system lymphoma,Hematopoietic neoplasm,Reportable,Core,,,,
C83.398,Diffuse large B-cell lymphoma extranodal and solid organ sites,Hematopoietic neoplasm,Reportable,Core,,,,
C83.3A,Diffuse large B-cell lymphoma in remission,Hematopoietic neoplasm,Reportable,Core,,,,
C83.5,Lymphoblastic (diffuse) lymphoma,Hematopoietic neoplasm,Subcategory Code,Subcategory Code (Core),,,,
C83.50,Lymphoblastic (diffuse) lymphoma unspecified site,Hematopoietic neoplasm,Reportable,Core,,,,
C83.51,"Lymphoblastic (diffuse) lymphoma lymph nodes of head, face, and neck",Hematopoietic neoplasm,Reportable,Core,,,,
C83.52,Lymphoblastic (diffuse) lymphoma intrathoracic lymph nodes,Hematopoietic neoplasm,Reportable,Core,,,,
C83.53,Lymphoblastic (diffuse) lymphoma intra-abdominal lymph nodes,Hematopoietic neoplasm,Reportable,Core,,,,
C83.54,Lymphoblastic (diffuse) lymphoma lymph nodes of axilla and upper limb,Hematopoietic neoplasm,Reportable,Core,,,,
C83.55,Lymphoblastic (diffuse) lymphoma lymph nodes of inguinal region and lower limb,Hematopoietic neoplasm,Reportable,Core,,,,
C83.56,Lymphoblastic (diffuse) lymphoma intrapelvic lymph nodes,Hematopoietic neoplasm,Reportable,Core,,,,
C83.57,Lymphoblastic (diffuse) lymphoma spleen,Hematopoietic neoplasm,Reportable,Core,,,,
C83.58,Lymphoblastic (diffuse) lymphoma lymph nodes of multiple sites,Hematopoietic neoplasm,Reportable,Core,,,,
C83.59,Lymphoblastic (diffuse) lymphoma extranodal and solid organ sites,Hematopoietic neoplasm,Reportable,Core,,,,
C83.5A,Lymphoblastic (diffuse) lymphoma in remission,Hematopoietic neoplasm,Reportable,Core,,,,
C83.7,Burkitt lymphoma,Hematopoietic neoplasm,Subcategory Code,Subcategory Code (Core),,,,
C83.70,Burkitt lymphoma unspecified site,Hematopoietic neoplasm,Reportable,Core,,,,
C83.71,"Burkitt lymphoma lymph nodes of head, face, and neck",Hematopoietic neoplasm,Reportable,Core,,,,
C83.72,Burkitt lymphoma intrathoracic lymph nodes,Hematopoietic neoplasm,Reportable,Core,,,,
C83.73,Burkitt lymphoma intra-abdominal lymph nodes,Hematopoietic neoplasm,Reportable,Core,,,,
C83.74,Burkitt lymphoma lymph nodes of axilla and upper limb,Hematopoietic neoplasm,Reportable,Core,,,,
C83.75,Burkitt lymphoma lymph nodes of inguinal region and lower limb,Hematopoietic neoplasm,Reportable,Core,,,,
C83.76,Burkitt lymphoma intrapelvic lymph nodes,Hematopoietic neoplasm,Reportable,Core,,,,
C83.77,Burkitt lymphoma spleen,Hematopoietic neoplasm,Reportable,Core,,,,
C83.78,Burkitt lymphoma lymph nodes of multiple sites,Hematopoietic neoplasm,Reportable,Core,,,,
C83.79,Burkitt lymphoma extranodal and solid organ sites,Hematopoietic neoplasm,Reportable,Core,,,,
C83.7A,Burkitt lymphoma in remission,Hematopoietic neoplasm,Reportable,Core,,,,
C83.8,Other non-follicular lymphoma,Hematopoietic neoplasm,Subcategory Code,Subcategory Code (Core),,,,
C83.80,Other non-follicular lymphoma unspecified site,Hematopoietic neoplasm,Reportable,Core,,,,
C83.81,"Other non-follicular lymphoma lymph nodes of head, face, and neck",Hematopoietic neoplasm,Reportable,Core,,,,
C83.82,Other non-follicular lymphoma intrathoracic lymph nodes,Hematopoietic neoplasm,Reportable,Core,,,,
C83.83,Other non-follicular lymphoma intra-abdominal lymph nodes,Hematopoietic neoplasm,Reportable,Core,,,,
C83.84,Other non-follicular lymphoma lymph nodes of axilla and upper limb,Hematopoietic neoplasm,Reportable,Core,,,,
C83.85,Other non-follicular lymphoma lymph nodes of inguinal region and lower limb,Hematopoietic neoplasm,Reportable,Core,,,,
C83.86,Other non-follicular lymphoma intrapelvic lymph nodes,Hematopoietic neoplasm,Reportable,Core,,,,
C83.87,Other non-follicular lymphoma spleen,Hematopoietic neoplasm,Reportable,Core,,,,
C83.88,Other non-follicular lymphoma lymph nodes of multiple sites,Hematopoietic neoplasm,Reportable,Core,,,,
C83.89,Other non-follicular lymphoma extranodal and solid organ sites,Hematopoietic neoplasm,Reportable,Core,,,,
C83.8A,Other non-follicular lymphoma in remission,Hematopoietic neoplasm,Reportable,Core,,,,
C83.9,"Non-follicular (diffuse) lymphoma, unspecified",Hematopoietic neoplasm,Subcategory Code,Subcategory Code (Core),,,,
C83.90,"Non-follicular (diffuse) lymphoma, unspecified site",Hematopoietic neoplasm,Reportable,Core,,,,
C83.91,"Non-follicular (diffuse) lymphoma, unspecified lymph nodes of head, face, and neck",Hematopoietic neoplasm,Reportable,Core,,,,
C83.92,"Non-follicular (diffuse) lymphoma, unspecified intrathoracic lymph nodes",Hematopoietic neoplasm,Reportable,Core,,,,
C83.93,"Non-follicular (diffuse) lymphoma, unspecified intra-abdominal lymph nodes",Hematopoietic neoplasm,Reportable,Core,,,,
C83.94,"Non-follicular (diffuse) lymphoma, unspecified lymph nodes of axilla and upper limb",Hematopoietic neoplasm,Reportable,Core,,,,
C83.95,"Non-follicular (diffuse) lymphoma, unspecified lymph nodes of inguinal region and lower limb",Hematopoietic neoplasm,Reportable,Core,,,,
C83.96,"Non-follicular (diffuse) lymphoma, unspecified intrapelvic lymph nodes",Hematopoietic neoplasm,Reportable,Core,,,,
C83.97,"Non-follicular (diffuse) lymphoma, unspecified spleen",Hematopoietic neoplasm,Reportable,Core,,,,
C83.98,"Non-follicular (diffuse) lymphoma, unspecified lymph nodes of multiple sites",Hematopoietic neoplasm,Reportable,Core,,,,
C83.99,"Non-follicular (diffuse) lymphoma, unspecified extranodal and solid organ sites",Hematopoietic neoplasm,Reportable,Core,,,,
C83.9A,"Non-follicular (diffuse) lymphoma, in remission",Hematopoietic neoplasm,Reportable,Core,,,,
C84,Mature T/NK-cell lymphomas,Hematopoietic neoplasm ,Category Code,Category Code (Core),,,,
C84.0,Mycosis fungoides,Hematopoietic neoplasm,Subcategory Code,Subcategory Code (Core),,,,
C84.00,Mycosis fungoides unspecified site,Hematopoietic neoplasm,Reportable,Core,,,,
C84.01,"Mycosis fungoides lymph nodes of head, face, and neck",Hematopoietic neoplasm,Reportable,Core,,,,
C84.02,Mycosis fungoides intrathoracic lymph nodes,Hematopoietic neoplasm,Reportable,Core,,,,
C84.03,Mycosis fungoides intra-abdominal lymph nodes,Hematopoietic neoplasm,Reportable,Core,,,,
C84.04,Mycosis fungoides lymph nodes of axilla and upper limb,Hematopoietic neoplasm,Reportable,Core,,,,
C84.05,Mycosis fungoides lymph nodes of inguinal region and lower limb,Hematopoietic neoplasm,Reportable,Core,,,,
C84.06,Mycosis fungoides intrapelvic lymph nodes,Hematopoietic neoplasm,Reportable,Core,,,,
C84.07,Mycosis fungoides spleen,Hematopoietic neoplasm,Reportable,Core,,,,
C84.08,Mycosis fungoides lymph nodes of multiple sites,Hematopoietic neoplasm,Reportable,Core,,,,
C84.09,Mycosis fungoides extranodal and solid organ sites,Hematopoietic neoplasm,Reportable,Core,,,,
C84.0A,Mycosis fungoides in remission,Hematopoietic neoplasm,Reportable,Core,,,,
C84.1,Szary disease,Hematopoietic neoplasm,Subcategory Code,Subcategory Code (Core),,,,
C84.10,Szary disease unspecified site,Hematopoietic neoplasm,Reportable,Core,,,,
C84.11,"Szary disease lymph nodes of head, face, and neck",Hematopoietic neoplasm,Reportable,Core,,,,
C84.12,Szary disease intrathoracic lymph nodes,Hematopoietic neoplasm,Reportable,Core,,,,
C84.13,Szary disease intra-abdominal lymph nodes,Hematopoietic neoplasm,Reportable,Core,,,,
C84.14,Szary disease lymph nodes of axilla and upper limb,Hematopoietic neoplasm,Reportable,Core,,,,
C84.15,Szary disease lymph nodes of inguinal region and lower limb,Hematopoietic neoplasm,Reportable,Core,,,,
C84.16,Szary disease intrapelvic lymph nodes,Hematopoietic neoplasm,Reportable,Core,,,,
C84.17,Szary disease spleen,Hematopoietic neoplasm,Reportable,Core,,,,
C84.18,Szary disease lymph nodes of multiple sites,Hematopoietic neoplasm,Reportable,Core,,,,
C84.19,Szary disease extranodal and solid organ sites,Hematopoietic neoplasm,Reportable,Core,,,,
C84.1A,Szary disease in remission,Hematopoietic neoplasm,Reportable,Core,,,,
C84.4,"Peripheral T-cell lymphoma, not classified",Hematopoietic neoplasm,Subcategory Code,Subcategory Code (Core),,,,
C84.40,"Peripheral T-cell lymphoma, not classified unspecified site",Hematopoietic neoplasm,Reportable,Core,,,,
C84.41,"Peripheral T-cell lymphoma, not classified lymph nodes of head, face, and neck",Hematopoietic neoplasm,Reportable,Core,,,,
C84.42,"Peripheral T-cell lymphoma, not classified intrathoracic lymph nodes",Hematopoietic neoplasm,Reportable,Core,,,,
C84.43,"Peripheral T-cell lymphoma, not classified intra-abdominal lymph nodes",Hematopoietic neoplasm,Reportable,Core,,,,
C84.44,"Peripheral T-cell lymphoma, not classified lymph nodes of axilla and upper limb",Hematopoietic neoplasm,Reportable,Core,,,,
C84.45,"Peripheral T-cell lymphoma, not classified lymph nodes of inguinal region and lower limb",Hematopoietic neoplasm,Reportable,Core,,,,
C84.46,"Peripheral T-cell lymphoma, not classified intrapelvic lymph nodes",Hematopoietic neoplasm,Reportable,Core,,,,
C84.47,"Peripheral T-cell lymphoma, not classified spleen",Hematopoietic neoplasm,Reportable,Core,,,,
C84.48,"Peripheral T-cell lymphoma, not classified lymph nodes of multiple sites",Hematopoietic neoplasm,Reportable,Core,,,,
C84.49,"Peripheral T-cell lymphoma, not classified extranodal and solid organ sites",Hematopoietic neoplasm,Reportable,Core,,,,
C84.4A,"Peripheral T-cell lymphoma, in remission",Hematopoietic neoplasm,Reportable,Core,,,,
C84.6,"Anaplastic large cell lymphoma, ALK-positive",Hematopoietic neoplasm,Subcategory Code,Subcategory Code (Core),,,,
C84.60,"Anaplastic large cell lymphoma, ALK-positive unspecified site",Hematopoietic neoplasm,Reportable,Core,,,,
C84.61,"Anaplastic large cell lymphoma, ALK-positive lymph nodes of head, face, and neck",Hematopoietic neoplasm,Reportable,Core,,,,
C84.62,"Anaplastic large cell lymphoma, ALK-positive intrathoracic lymph nodes",Hematopoietic neoplasm,Reportable,Core,,,,
C84.63,"Anaplastic large cell lymphoma, ALK-positive intra-abdominal lymph nodes",Hematopoietic neoplasm,Reportable,Core,,,,
C84.64,"Anaplastic large cell lymphoma, ALK-positive lymph nodes of axilla and upper limb",Hematopoietic neoplasm,Reportable,Core,,,,
C84.65,"Anaplastic large cell lymphoma, ALK-positive lymph nodes of inguinal region and lower limb",Hematopoietic neoplasm,Reportable,Core,,,,
C84.66,"Anaplastic large cell lymphoma, ALK-positive intrapelvic lymph nodes",Hematopoietic neoplasm,Reportable,Core,,,,
C84.67,"Anaplastic large cell lymphoma, ALK-positive spleen",Hematopoietic neoplasm,Reportable,Core,,,,
C84.68,"Anaplastic large cell lymphoma, ALK-positive lymph nodes of multiple sites",Hematopoietic neoplasm,Reportable,Core,,,,
C84.69,"Anaplastic large cell lymphoma, ALK-positive extranodal and solid organ sites",Hematopoietic neoplasm,Reportable,Core,,,,
C84.6A,"Anaplastic large cell lymphoma, in remission",Hematopoietic neoplasm,Reportable,Core,,,,
C84.7,"Anaplastic large cell lymphoma, ALK-negative",Hematopoietic neoplasm,Subcategory Code,Subcategory Code (Core),,,,
C84.70,"Anaplastic large cell lymphoma, ALK-negative unspecified site",Hematopoietic neoplasm,Reportable,Core,,,,
C84.71,"Anaplastic large cell lymphoma, ALK-negative lymph nodes of head, face, and neck",Hematopoietic neoplasm,Reportable,Core,,,,
C84.72,"Anaplastic large cell lymphoma, ALK-negative intrathoracic lymph nodes",Hematopoietic neoplasm,Reportable,Core,,,,
C84.73,"Anaplastic large cell lymphoma, ALK-negative intra-abdominal lymph nodes",Hematopoietic neoplasm,Reportable,Core,,,,
C84.74,"Anaplastic large cell lymphoma, ALK-negative lymph nodes of axilla and upper limb",Hematopoietic neoplasm,Reportable,Core,,,,
C84.75,"Anaplastic large cell lymphoma, ALK-negative lymph nodes of inguinal region and lower limb",Hematopoietic neoplasm,Reportable,Core,,,,
C84.76,"Anaplastic large cell lymphoma, ALK-negative intrapelvic lymph nodes",Hematopoietic neoplasm,Reportable,Core,,,,
C84.77,"Anaplastic large cell lymphoma, ALK-negative spleen",Hematopoietic neoplasm,Reportable,Core,,,,
C84.78,"Anaplastic large cell lymphoma, ALK-negative lymph nodes of multiple sites",Hematopoietic neoplasm,Reportable,Core,,,,
C84.79,"Anaplastic large cell lymphoma, ALK-negative extranodal and solid organ sites",Hematopoietic neoplasm,Reportable,Core,,,,
C84.7A,"Anaplastic large cell lymphoma, ALK-negative, breast",Hematopoietic neoplasm,Reportable,Core,,,,
C84.7B,"Anaplastic large cell lymphoma, ALK-negative, in remission",Hematopoietic neoplasm,Reportable,Core,,,,
C84.A,"Cutaneous T-cell lymphoma, unspecified",Hematopoietic neoplasm,Subcategory Code,Subcategory Code (Core),,,,
C84.A0,"Cutaneous T-cell lymphoma, unspecified, unspecified site",Hematopoietic neoplasm,Reportable,Core,,,,
C84.A1,"Cutaneous T-cell lymphoma, unspecified, lymph nodes of head, face, and neck",Hematopoietic neoplasm,Reportable,Core,,,,
C84.A2,"Cutaneous T-cell lymphoma, unspecified, intrathoracic lymph nodes",Hematopoietic neoplasm,Reportable,Core,,,,
C84.A3,"Cutaneous T-cell lymphoma, unspecified, intra-abdominal lymph nodes",Hematopoietic neoplasm,Reportable,Core,,,,
C84.A4,"Cutaneous T-cell lymphoma, unspecified, lymph nodes of axilla and upper limb",Hematopoietic neoplasm,Reportable,Core,,,,
C84.A5,"Cutaneous T-cell lymphoma, unspecified, lymph nodes of inguinal region and lower limb",Hematopoietic neoplasm,Reportable,Core,,,,
C84.A6,"Cutaneous T-cell lymphoma, unspecified, intrapelvic lymph nodes",Hematopoietic neoplasm,Reportable,Core,,,,
C84.A7,"Cutaneous T-cell lymphoma, unspecified, spleen",Hematopoietic neoplasm,Reportable,Core,,,,
C84.A8,"Cutaneous T-cell lymphoma, unspecified, lymph nodes of multiple sites",Hematopoietic neoplasm,Reportable,Core,,,,
C84.A9,"Cutaneous T-cell lymphoma, unspecified, extranodal and solid organ sites",Hematopoietic neoplasm,Reportable,Core,,,,
C84.AA,"Cutaneous T-cell lymphoma, unspecified, in remission",Hematopoietic neoplasm,Reportable,Core,,,,
C84.Z,Other mature T/NK-cell lymphomas,Hematopoietic neoplasm,Subcategory Code,Subcategory Code (Core),,,,
C84.Z0,"Other mature T/NK-cell lymphomas, unspecified site",Hematopoietic neoplasm,Reportable,Core,,,,
C84.Z1,"Other mature T/NK-cell lymphomas, lymph nodes of head, face, and neck",Hematopoietic neoplasm,Reportable,Core,,,,
C84.Z2,"Other mature T/NK-cell lymphomas, intrathoracic lymph nodes",Hematopoietic neoplasm,Reportable,Core,,,,
C84.Z3,"Other mature T/NK-cell lymphomas, intra-abdominal lymph nodes",Hematopoietic neoplasm,Reportable,Core,,,,
C84.Z4,"Other mature T/NK-cell lymphomas, lymph nodes of axilla and upper limb",Hematopoietic neoplasm,Reportable,Core,,,,
C84.Z5,"Other mature T/NK-cell lymphomas, lymph nodes of inguinal region and lower limb",Hematopoietic neoplasm,Reportable,Core,,,,
C84.Z6,"Other mature T/NK-cell lymphomas, intrapelvic lymph nodes",Hematopoietic neoplasm,Reportable,Core,,,,
C84.Z7,"Other mature T/NK-cell lymphomas, spleen",Hematopoietic neoplasm,Reportable,Core,,,,
C84.Z8,"Other mature T/NK-cell lymphomas, lymph nodes of multiple sites",Hematopoietic neoplasm,Reportable,Core,,,,
C84.Z9,"Other mature T/NK-cell lymphomas, extranodal and solid organ sites",Hematopoietic neoplasm,Reportable,Core,,,,
C84.ZA,"Other mature T/NK-cell lymphomas, in remission",Hematopoietic neoplasm,Reportable,Core,,,,
C84.9,"Mature T/NK-cell lymphomas, unspecified",Hematopoietic neoplasm,Subcategory Code,Subcategory Code (Core),,,,
C84.90,"Mature T/NK-cell lymphomas, unspecified, unspecified site",Hematopoietic neoplasm,Reportable,Core,,,,
C84.91,"Mature T/NK-cell lymphomas, unspecified, lymph nodes of head, face, and neck",Hematopoietic neoplasm,Reportable,Core,,,,
C84.92,"Mature T/NK-cell lymphomas, unspecified, intrathoracic lymph nodes",Hematopoietic neoplasm,Reportable,Core,,,,
C84.93,"Mature T/NK-cell lymphomas, unspecified, intra-abdominal lymph nodes",Hematopoietic neoplasm,Reportable,Core,,,,
C84.94,"Mature T/NK-cell lymphomas, unspecified, lymph nodes of axilla and upper limb",Hematopoietic neoplasm,Reportable,Core,,,,
C84.95,"Mature T/NK-cell lymphomas, unspecified, lymph nodes of inguinal region and lower limb",Hematopoietic neoplasm,Reportable,Core,,,,
C84.96,"Mature T/NK-cell lymphomas, unspecified, intrapelvic lymph nodes",Hematopoietic neoplasm,Reportable,Core,,,,
C84.97,"Mature T/NK-cell lymphomas, unspecified, spleen",Hematopoietic neoplasm,Reportable,Core,,,,
C84.98,"Mature T/NK-cell lymphomas, unspecified, lymph nodes of multiple sites",Hematopoietic neoplasm,Reportable,Core,,,,
C84.99,"Mature T/NK-cell lymphomas, unspecified, extranodal and solid organ sites",Hematopoietic neoplasm,Reportable,Core,,,,
C84.9A,"Mature T/NK-cell lymphomas, unspecified, in remission",Hematopoietic neoplasm,Reportable,Core,,,,
C85,Other specified and unspecified types of non-Hodgkin lymphoma,Hematopoietic neoplasm ,Category Code,Category Code (Core),,,,
C85.1,Unspecified B-cell lymphoma,Hematopoietic neoplasm,Subcategory Code,Subcategory Code (Core),,,,
C85.10,"Unspecified B-cell lymphoma, unspecified site",Hematopoietic neoplasm,Reportable,Core,,,,
C85.11,"Unspecified B-cell lymphoma, lymph nodes of head, face, and neck",Hematopoietic neoplasm,Reportable,Core,,,,
C85.12,"Unspecified B-cell lymphoma, intrathoracic lymph nodes",Hematopoietic neoplasm,Reportable,Core,,,,
C85.13,"Unspecified B-cell lymphoma, intra-abdominal lymph nodes",Hematopoietic neoplasm,Reportable,Core,,,,
C85.14,"Unspecified B-cell lymphoma, lymph nodes of axilla and upper limb",Hematopoietic neoplasm,Reportable,Core,,,,
C85.15,"Unspecified B-cell lymphoma, lymph nodes of inguinal region and lower limb",Hematopoietic neoplasm,Reportable,Core,,,,
C85.16,"Unspecified B-cell lymphoma, intrapelvic lymph nodes",Hematopoietic neoplasm,Reportable,Core,,,,
C85.17,"Unspecified B-cell lymphoma, spleen",Hematopoietic neoplasm,Reportable,Core,,,,
C85.18,"Unspecified B-cell lymphoma, lymph nodes of multiple sites",Hematopoietic neoplasm,Reportable,Core,,,,
C85.19,"Unspecified B-cell lymphoma, extranodal and solid organ sites",Hematopoietic neoplasm,Reportable,Core,,,,
C85.1A,"Unspecified B-cell lymphoma, in remission",Hematopoietic neoplasm,Reportable,Core,,,,
C85.2,Mediastinal (thymic) large B-cell lymphoma,Hematopoietic neoplasm,Subcategory Code,Subcategory Code (Core),,,,
C85.20,"Mediastinal (thymic) large B-cell lymphoma, unspecified site",Hematopoietic neoplasm,Reportable,Core,,,,
C85.21,"Mediastinal (thymic) large B-cell lymphoma, lymph nodes of head, face, and neck",Hematopoietic neoplasm,Reportable,Core,,,,
C85.22,"Mediastinal (thymic) large B-cell lymphoma, intrathoracic lymph nodes",Hematopoietic neoplasm,Reportable,Core,,,,
C85.23,"Mediastinal (thymic) large B-cell lymphoma, intra-abdominal lymph nodes",Hematopoietic neoplasm,Reportable,Core,,,,
C85.24,"Mediastinal (thymic) large B-cell lymphoma, lymph nodes of axilla and upper limb",Hematopoietic neoplasm,Reportable,Core,,,,
C85.25,"Mediastinal (thymic) large B-cell lymphoma, lymph nodes of inguinal region and lower limb",Hematopoietic neoplasm,Reportable,Core,,,,
C85.26,"Mediastinal (thymic) large B-cell lymphoma, intrapelvic lymph nodes",Hematopoietic neoplasm,Reportable,Core,,,,
